湖南省长沙铁路第三幼儿园,['湖南省 长沙市 长沙县'],['示范幼儿园'],['公办'],['幼儿园'],['湖南省长沙市'],['0731-82636931']
长沙市雨花区友谊幼儿园,['湖南省 长沙市'],['示范幼儿园'],['公办'],['幼儿园'],['友谊新村四小区友谊街104号'],['0731-5712715']
东方中英文幼稚园,['湖南省 长沙市'],['示范幼儿园'],['公办'],['幼儿园'],['长沙市树木岭自然岭5号'],['0731-85683355']
智慧树早教中心,['湖南省 长沙市 宁乡县'],['示范幼儿园'],['公办'],['幼儿园'],['宁乡县成功塘集镇'],['15874834048']
长沙市雅塘村艺术幼儿园,['湖南省 长沙市 雨花区'],['示范幼儿园'],['公办'],['幼儿园'],['湖南省长沙市雨花区雅塘村88'],['5050369']
长沙市教育局幼儿园,['湖南省 长沙市 长沙县'],['示范幼儿园'],['公办'],['幼儿园'],['湖南省长沙市恒达路113号'],['0731-4789827']
湖南文化厅艺术幼儿园,['湖南省 长沙市 芙蓉区'],['一级幼儿园'],['公办'],['幼儿园'],['湖南省长沙市芙蓉区人民中路259号'],['0731-81473300']
长沙市天心区幼幼幼儿园,['湖南省 长沙市 天心区'],['示范幼儿园'],['公办'],['幼儿园'],['湖南省长沙市天心区青山祠巷23号'],['0731-85121743']
长沙师范学校附属幼儿园,['湖南省 长沙市 长沙县'],['示范幼儿园'],['公办'],['幼儿园'],['湖南长沙市开福区蔡锷北路351号'],['0731-84312229']
长沙华龙白沙幼儿园,['湖南省 长沙市 长沙县'],['示范幼儿园'],['民办'],['幼儿园'],['长沙市芙蓉中路二段200号贺龙体育广场旁新世纪花园内'],['0731-85583408 13874952934']
长沙市诺贝尔摇篮金帆校区幼儿园,['湖南省 长沙市 开福区'],['示范幼儿园'],['民办'],['幼儿园'],['湖南省长沙市开福区金帆小区'],['0731-84826908']
湖南大学幼儿园,['湖南省 长沙市 岳麓区'],['示范幼儿园'],['公办'],['幼儿园'],['长沙市岳麓区麓山南路'],['0731-8821805 13714894992']
星沙当代摩码幼儿园,['湖南省 长沙市 长沙县'],['示范幼儿园'],['民办'],['幼儿园'],['开园东路与东八线交汇处当代广场小区内9栋'],['86841256']
长沙市金色梯田幼儿园（万熙园）,['湖南省 长沙市 开福区'],['示范幼儿园'],['民办'],['幼儿园'],['长沙市开福区三一大道203号万煦园小区'],['0731-84581122']
湖南省水利厅幼儿园,['湖南省 长沙市 天心区'],['示范幼儿园'],['公办'],['幼儿园'],['湖南省长沙市韶山北路370号'],['0731-85486004']
湖南省政府直属机关第一幼儿园,['湖南省 长沙市 芙蓉区'],['示范幼儿园'],['公办'],['幼儿园'],['湖南省长沙市桐荫里136'],['0731-84445051']
长沙市万婴幼儿园,['湖南省 长沙市 芙蓉区'],['示范幼儿园'],['民办'],['幼儿园'],['湖南省长沙市芙蓉区马王堆中路'],['0731-84760135']
长沙六艺天骄幼儿园,['湖南省 长沙市 长沙县'],['示范幼儿园'],['民办'],['幼儿园'],['湖南省长沙市长沙县板仓北路板仓路397号'],['0731-84014179']
长沙市雨花区万婴蒙氏湖橡幼儿园,['湖南省 长沙市 雨花区'],['示范幼儿园'],['民办'],['幼儿园'],['湖南省长沙市雨花区韶山北路163-1 长沙市雨花区古曲南路198号 茂华国际湘小区内万婴幼儿园总部'],['0731-84130215 4008897000']
长沙理工大学幼儿园,['湖南省 长沙市 天心区'],['示范幼儿园'],['公办'],['幼儿园'],['湖南省长沙市天心区赤岭路45号'],['0731-82618144']
长沙市瑞思玛特幼儿园,['湖南省 长沙市'],['示范幼儿园'],['公办'],['幼儿园'],['湖南省长沙市五一广场联合商厦'],['0731-3520001/3520002']
株洲市茨菇塘育才幼儿园,['湖南省 长沙市'],['普通'],[],['幼儿园'],['湖南省株洲市荷塘区茨菇塘天鹅花园'],['13017136']
长沙市雨花区左家塘街道长塘里幼儿园,['湖南省 长沙市'],['普通'],[],['幼儿园'],['湖南省郊区广济桥'],[]
长沙市正园动力配件责任有限公司幼儿园,['湖南省 长沙市 雨花区'],['普通'],[],['幼儿园'],['湖南省长沙市雨花区劳动东路32号'],['5597531']
株洲县第二机关幼儿园,['湖南省 长沙市'],['普通'],[],['幼儿园'],['湖南省株洲县渌口向阳'],['7615841']
长沙市爱婴儿幼儿园,['湖南省 长沙市 长沙县'],['二级幼儿园'],['民办'],['幼儿园'],['湖南省长沙市王家湾北左家垅小区桃花村居委会旁'],['0731-89829518']
湖南仪器仪表总厂西点实验幼儿园,['湖南省 长沙市 岳麓区'],['普通'],[],['幼儿园'],['湖南省长沙市岳麓区湘仪路'],['8142879']
茶陵县金太阳幼儿园,['湖南省 长沙市'],['普通'],[],['幼儿园'],['湖南省茶陵县城关炎帝中路'],['5229485']
株洲市荷塘区东湖幼儿园,['湖南省 长沙市'],['普通'],[],['幼儿园'],['湖南省株洲市荷塘区月塘东湖'],['8110251']
长沙天桥幼儿园,['湖南省 长沙市 长沙县'],['示范幼儿园'],['公办'],['幼儿园'],['长沙经济技术开发区板仓路397号'],['0731-4014179']
长沙县福临镇中心幼儿园,['湖南省 长沙市 长沙县'],['普通'],[],['幼儿园'],[],[]
醴陵市来龙门街道办事处文庙幼儿园,['湖南省 长沙市'],['普通'],[],['幼儿园'],['湖南省醴陵市文庙'],['3233010']
炎陵县水口镇小天使幼儿园,['湖南省 长沙市'],['普通'],[],['幼儿园'],['湖南省炎陵县水口镇水南'],['6422154']
长沙中华明星幼儿园,['湖南省 长沙市 长沙县'],['示范幼儿园'],['公办'],['幼儿园'],['湖南省长沙县星沙镇石子村'],['0731-84138268']
长沙市雨花区童馨幼儿园,['湖南省 长沙市'],['示范幼儿园'],['公办'],['幼儿园'],['长沙市市辖区'],['0731-85950095']
攸县机关幼儿园,['湖南省 长沙市'],['普通'],[],['幼儿园'],['湖南省攸县城关建设路'],['4223757']
醴陵市博雅幼儿园,['湖南省 长沙市'],['普通'],[],['幼儿园'],['湖南省醴陵市渌江泉湖'],['3032418']
长沙诺贝尔摇篮早教研究所实验园,['湖南省 长沙市 长沙县'],['普通'],[],['幼儿园'],[],[]
长沙市广厦新村广厦幼儿园,['湖南省 长沙市 长沙县'],['普通'],[],['幼儿园'],['湖南省长沙市新开铺附213号'],['5420826']
长沙县安沙镇安沙幼儿园,['湖南省 长沙市 长沙县'],['普通'],[],['幼儿园'],['安沙镇安沙中路８３号'],['6706825']
雨花区新都幼儿园,['湖南省 长沙市'],['示范幼儿园'],['公办'],['幼儿园'],['长沙市市辖区'],['0731-85350887']
茶陵县花蕾幼儿园,['湖南省 长沙市'],['普通'],[],['幼儿园'],['湖南省茶陵县城关解放'],['5236853']
长沙县果园镇小精灵幼儿园,['湖南省 长沙市 长沙县'],['示范幼儿园'],['公办'],['幼儿园'],['果园镇大河村'],['0731-86188111 6183324']
万婴教育机构,['湖南省 长沙市 雨花区'],['示范幼儿园'],['民办'],['幼儿园'],['长沙市雨花区古曲南路198号茂华国际湘小区'],['0731-85328900']
长沙市人民政府机关第三幼儿园,['湖南省 长沙市 芙蓉区'],['示范幼儿园'],['公办'],['幼儿园'],['长沙市芙蓉区杨家山市政府宿舍内'],['0731-84727284']
株洲市培培幼儿园,['湖南省 长沙市'],['普通'],[],['幼儿园'],['湖南省株洲市荷塘区荷塘铺郭散户'],['8426446']
长沙博康超前实验幼儿园,['湖南省 长沙市 雨花区'],['普通'],[],['幼儿园'],['湖南省长沙市雨花区韶山南路1号'],['5582086']
宁乡县香山幼儿园,['湖南省 长沙市 宁乡县'],['普通'],[],['幼儿园'],['湖南省宁乡县玉潭镇香山巷106号'],['7887988']
红黄蓝亲子园长沙三色光园,['湖南省 长沙市 芙蓉区'],['示范幼儿园'],['公办'],['幼儿园'],['长沙市人民东路5号东方之珠广场商务楼三层306号'],['0731-2201902; 2201932; 2201937']
长沙市天心区小天使幼儿园,['湖南省 长沙市 天心区'],['示范幼儿园'],['公办'],['幼儿园'],['天心区里仁坡33号小天使幼儿园'],['0731 -5128022']
长沙市都正街中心幼儿园,['湖南省 长沙市 芙蓉区'],['示范幼儿园'],['公办'],['幼儿园'],['长沙市芙蓉区都正街吉庆巷27号'],['0731-4447084']
国防科大第三附属幼儿园,['湖南省 长沙市'],['普通'],[],['幼儿园'],[],['4215551']
湖南省水利水电机械施工公司幼儿园,['湖南省 长沙市 天心区'],['普通'],[],['幼儿园'],['湖南省长沙市天心区南湖路25号'],['5217464']
长沙市雨花区天华实验幼儿园,['湖南省 长沙市 雨花区'],['一级幼儿园'],['公办'],['幼儿园'],['湖南省长沙市雨花区湘府东路'],['0731-85056555']
长沙市心悦芭学园（幼儿园）,['湖南省 长沙市 开福区'],['普通'],['私立'],['幼儿园'],['长沙市开福区山月路心悦芭学园（御景龙城旁）'],['13607434312']
野鹤与湘警,['湖南省 长沙市'],['普通'],[],['幼儿园'],[],['13637419235']
长沙市人民政府机关荷花（第一）幼儿园,['湖南省 长沙市 开福区'],['一级幼儿园'],['公办'],['幼儿园'],['湖南省长沙市开福区荷花池巷茅亭子巷110号'],['0731-84451704']
长沙市人民政府机关第二幼儿园,['湖南省 长沙市 长沙县'],['示范幼儿园'],['公办'],['幼儿园'],['长沙市岳麓区八方小区二期B区（岳麓区观沙路269号）'],['0731-2222541']
长沙奥星幼儿园,['湖南省 长沙市 开福区'],['示范幼儿园'],['公办'],['幼儿园'],['湖南省长沙市开福区体育馆路1号'],['2237237']
长沙市政府机关荷花幼儿园,['湖南省 长沙市 开福区'],['一级幼儿园'],['公办'],['幼儿园'],['湖南省长沙市开福区荷花池巷茅亭子巷110号'],['0731-84451704']
湖南省军区幼儿园,['湖南省 长沙市 长沙县'],['示范幼儿园'],['公办'],['幼儿园'],['湖南省长沙市迎宾路196号'],['0731-82256736']
虹猫蓝兔幼稚园学园雍景幼稚园,['湖南省 长沙市 芙蓉区'],['二级幼儿园'],['民办'],['幼儿园'],['长沙市芙蓉区车站北路雍景园'],['0731-82296621']
湖南省新湘幼儿园,['湖南省 长沙市 长沙县'],['一级幼儿园'],['公办'],['幼儿园'],['湖南省长沙韶山路1号'],['0731-2217647']
株洲市石峰区天福幼儿园,['湖南省 长沙市'],['普通'],[],['幼儿园'],['湖南省株洲市石峰区清水塘'],['8394793']
长沙县机关幼儿园,['湖南省 长沙市 开福区'],['示范幼儿园'],['公办'],['幼儿园'],['长沙市开福区潘家坪路108号'],['0731-84394003']
长沙市粮食局幼儿园,['湖南省 长沙市 天心区'],['二级幼儿园'],['公办'],['幼儿园'],['湖南省长沙市天心区劳动新村巷41号'],['0731-85159187']
湖南省政府直属机关第二幼儿园,['湖南省 长沙市 芙蓉区'],['示范幼儿园'],['公办'],['幼儿园'],['湖南省长沙市芙蓉区文艺路黄泥坑1号'],['0731-4441210']
长沙市雨花区金太阳幼儿园,['湖南省 长沙市 雨花区'],['一级幼儿园'],['民办'],['幼儿园'],['湖南省长沙市雨花区曙光中路27号'],['0731- 4110398']
中南大学校本部幼儿园,['湖南省 长沙市'],['一级幼儿园'],['公办'],['幼儿园'],['湖南省长沙市岳麓区麓山南路'],['0731-88830612']
长沙华龙丽江园,['湖南省 长沙市 天心区'],['二级幼儿园'],['私立'],['幼儿园'],['湖南省长沙市下新市街51丽江翠园小区'],['0731-85264895']
长沙市芙蓉区教育局第二幼儿园,['湖南省 长沙市 芙蓉区'],['一级幼儿园'],['公办'],['幼儿园'],['湖南省长沙市德政街46号'],['0731-4763522,4768702']
长沙市天心区小百合幼儿园,['湖南省 长沙市 天心区'],['二级幼儿园'],['民办'],['幼儿园'],['湖南省长沙市天心区友谊社区别墅园4―3栋'],['0731-2177568']
长沙市雨花区教育局第二幼儿园,['湖南省 长沙市 雨花区'],['一级幼儿园'],['公办'],['幼儿园'],['湖南省长沙市雨花区曙光南路王家冲小区内'],['0731-85555839']
长沙市开福区快乐小宝贝幼儿园,['湖南省 长沙市 开福区'],['二级幼儿园'],['民办'],['幼儿园'],['长沙市开福区金马路景香苑'],['18874933168']
长沙市育仁幼稚园,['湖南省 长沙市 天心区'],['二级幼儿园'],['公办'],['幼儿园'],['湖南省长沙市天心区新开铺路'],['0731-85415231']
湖南省文化厅艺术幼儿园,['湖南省 长沙市 芙蓉区'],['示范幼儿园'],['公办'],['幼儿园'],['湖南省长沙市芙蓉区人民中路255号'],['4152634']
长沙市小新星・智慧桥国际幼稚园,['湖南省 长沙市 雨花区'],['一级幼儿园'],['公办'],['幼儿园'],['长沙市雨花区茶园坡路76号新华园小区'],['0731-85143317']
湖南省湘警超级幼儿园,['湖南省 长沙市 雨花区'],['一级幼儿园'],['私立'],['幼儿园'],['湖南省长沙市雨花区东花路'],['0731-84725366']
长沙市岳麓区教育局实验幼儿园,['湖南省 长沙市 岳麓区'],['示范幼儿园'],['公办'],['幼儿园'],['湖南省长沙市岳麓区桐文巷36号潇湘陵园望月湖小区内'],['0731-88801150']
长沙绿城育华幼儿园,['湖南省 长沙市 长沙县'],['一级幼儿园'],['民办'],['幼儿园'],['湖南省长沙大道508号绿城桂花城'],['0731-4774526']
长沙市双爱幼儿园,['湖南省 长沙市 长沙县'],['一级幼儿园'],['民办'],['幼儿园'],['湖南省长沙市开福区东风路19号'],['0731-84438692']
长沙金色童年幼儿园,['湖南省 长沙市 浏阳市'],['二级幼儿园'],['民办'],['幼儿园'],['湖南省长沙市浏阳市金沙南路'],['0731-83657376']
长沙岳麓区教育局实验幼儿园,['湖南省 长沙市 岳麓区'],['一级幼儿园'],['公办'],['幼儿园'],['湖南省长沙市河西桐梓坡居民小区内'],['0731-8801150']
长沙市红星幼儿园,['湖南省 长沙市 雨花区'],['一级幼儿园'],['公办'],['幼儿园'],['湖南省长沙市雨花区井圭路'],['0731-85010810']
望城县坪塘镇中心幼儿园,['湖南省 长沙市 望城区'],['普通'],[],['幼儿园'],['坪塘镇邮电局'],['8507366']
长沙市雨花区教育局第一幼儿园,['湖南省 长沙市'],['一级幼儿园'],['公办'],['幼儿园'],['湖南省长沙市金地社区桔香鑫城对面'],['0731-88870789']
湖南省人民政府直属机关第三幼儿园,['湖南省 长沙市 芙蓉区'],['一级幼儿园'],['公办'],['幼儿园'],['湖南省长沙市芙蓉区燕山街127号'],['0731-84468758']
长沙市天心区幸运生幼儿园,['湖南省 长沙市 天心区'],['示范幼儿园'],['公办'],['幼儿园'],['长沙市天心区书院路44'],['0731-5815042']
天心区中兴幼儿园,['湖南省 长沙市 天心区'],['示范幼儿园'],['公办'],['幼儿园'],['湖南省长沙市天心区松柏里57号'],['0731-4442478']
长沙市通泰街地区中心幼儿园,['湖南省 长沙市 芙蓉区'],['示范幼儿园'],['公办'],['幼儿园'],['通泰街办事处寿星街7号'],['0731-2238689']
长沙蓝猫幼儿园,['湖南省 长沙市 长沙县'],['示范幼儿园'],['公办'],['幼儿园'],['湖南长沙'],[]
湖南省华铭实验第二幼稚园,['湖南省 长沙市'],['普通'],['公办'],['幼儿园'],['湖南省长沙市'],[]
长沙卷烟厂幼儿园,['湖南省 长沙市 长沙县'],['普通'],['私立'],['幼儿园'],['湖南省郊区劳动东路125号'],[]
湖南省第六工程公司长沙市小不点幼儿园,['湖南省 长沙市 天心区'],['普通'],['民办'],['幼儿园'],['湖南省长沙市天心区夏家冲'],['5149311']
长沙市铁山幼儿园,['湖南省 长沙市 开福区'],['示范幼儿园'],['公办'],['幼儿园'],['湖南省长沙市开福区铁佛东街10号'],['4312507']
长沙市商业幼儿园,['湖南省 长沙市 芙蓉区'],['普通'],['公办'],['幼儿园'],['湖南省长沙市芙蓉区曙光路27号'],['0731-4132494']
攸县黄丰桥镇康乐乐幼儿园,['湖南省 长沙市'],['普通'],[],['幼儿园'],['湖南省攸县黄丰桥湖丽坪'],['4683020']
长沙中南大学校本部幼儿园,['湖南省 长沙市 长沙县'],['普通'],[],['幼儿园'],[],[]
茶陵县星苑幼儿园,['湖南省 长沙市'],['普通'],[],['幼儿园'],['湖南省茶陵县城关茶攸路'],['5261622']
长沙市天心区阳光第六幼儿园,['湖南省 长沙市 天心区'],['普通'],['民办'],['幼儿园'],['长沙市天心区楚湘街二条巷一号'],['0731-85137635']
望城县乔口镇中心幼儿园,['湖南省 长沙市 望城区'],['普通'],['公办'],['幼儿园'],['乔口镇古正街'],['8361733']
长沙县榔梨镇苗苗幼儿园,['湖南省 长沙市 长沙县'],['普通'],[],['幼儿园'],['榔梨镇土岭村９３号'],['6802155']
湖南省少儿图书馆幼儿园,['湖南省 长沙市'],['普通'],[],['幼儿园'],[],[]
长沙县安沙镇春蕾幼儿园,['湖南省 长沙市 长沙县'],['普通'],['公办'],['幼儿园'],['安沙镇长塘村９５号'],['4092212']
长沙市安安幼儿园,['湖南省 长沙市 开福区'],['普通'],[],['幼儿园'],['湖南省长沙市开福区蒋家垅30栋17号'],['4493883']
长沙县星沙镇蓝天艺术幼儿园,['湖南省 长沙市 长沙县'],['普通'],['公办'],['幼儿园'],['星沙镇四区３５栋２６８号'],['410100']
长沙市火炬村小明星幼儿园,['湖南省 长沙市 芙蓉区'],['普通'],['公办'],['幼儿园'],['湖南省长沙芙蓉区火炬村'],['0731-85950095']
长沙天心区小风车幼儿园,['湖南省 长沙市 天心区'],['普通'],['公办'],['幼儿园'],['长沙市天心区新开铺路36号'],['0731-5410039']
株洲市荷塘区幼儿园,['湖南省 长沙市'],['普通'],[],['幼儿园'],['湖南省株洲市荷塘区茨菇塘红旗中路'],['8411170']
望城县星城镇中心幼儿园,['湖南省 长沙市 望城区'],['普通'],['公办'],['幼儿园'],['湖南省望城县星城镇东马社区雷锋大道、金星大道路口'],['0731--8381688']
长沙芙蓉区教育局第一幼儿园,['湖南省 长沙市 长沙县'],['普通'],[],['幼儿园'],['长沙市靴蓉区'],['0731-4154506']
贝贝星双语幼儿园,['湖南省 长沙市'],['普通'],[],['幼儿园'],[],['13755092722\n我园长期招聘优秀带班老师及幼师学校毕业的教学老师!\n(未毕业学生']
星沙阳光中英文艺术幼儿园,['湖南省 长沙市'],['普通'],[],['幼儿园'],[],[]
长沙市花蕾幼儿园,['湖南省 长沙市 长沙县'],['普通'],[],['幼儿园'],[],[]
智慧树*申奥双语幼稚园,['湖南省 长沙市'],['普通'],[],['幼儿园'],[],[]
,['湖南省 长沙市'],['普通'],[],['幼儿园'],[],['13755034138']
长沙市雨花区金色年华幼稚园,['湖南省 长沙市'],['普通'],[],['幼儿园'],[],[]
长沙少儿英语幼儿园,['湖南省 长沙市 长沙县'],['普通'],[],['幼儿园'],[],[]
长沙市小不点幼儿园,['湖南省 长沙市 长沙县'],['普通'],[],['幼儿园'],[],[]
长沙市飞虎家族幼儿体智能中心,['湖南省 长沙市 长沙县'],['普通'],[],['幼儿园'],[],[]
湖南省政府附属第一幼儿院,['湖南省 长沙市'],['普通'],[],['幼儿园'],[],[]
长沙市雨花区万婴蒙氏幼稚园,['湖南省 长沙市'],['普通'],[],['幼儿园'],['韶山中路１８号中机国际工程设计研究院内'],['5535700']
长沙市人民政府机关荷花幼儿园分园,['湖南省 长沙市 长沙县'],['普通'],[],['幼儿园'],['国庆新村一片十三栋'],['4374652']
每一天的新鲜,['湖南省 长沙市'],['普通'],[],['幼儿园'],[],[]
望城县雨敞坪镇中心幼儿园,['湖南省 长沙市 望城区'],['普通'],[],['幼儿园'],['雨敞坪镇'],['8320829']
长沙县暮云镇长株潭中心艺术幼儿园,['湖南省 长沙市 长沙县'],['普通'],[],['幼儿园'],['暮云镇长潭街５７号'],['6911678']
长沙市雨花区左家塘街道赤岗幼儿园,['湖南省 长沙市'],['普通'],[],['幼儿园'],['湖南省郊区赤岗二片'],[]
长沙县春华镇小叮当幼儿园,['湖南省 长沙市 长沙县'],['普通'],[],['幼儿园'],['春华镇新街'],['13507498005']
长沙电机厂幼儿园,['湖南省 长沙市 长沙县'],['普通'],[],['幼儿园'],['湖南省郊区韶山中路412号'],[]
长沙标准件总厂幼儿园,['湖南省 长沙市 长沙县'],['普通'],[],['幼儿园'],['湖南省郊区曙光中路20号'],[]
沙市中心幼儿园,['湖南省 长沙市'],['普通'],[],['幼儿园'],[],[]
湖南省长沙县北山镇新桥幼儿园,['湖南省 长沙市 长沙县'],['普通'],[],['幼儿园'],['湖南省长沙县北山镇新桥'],['6770137']
长沙铁路总公司衡阳生活管理段衡北幼儿园,['湖南省 长沙市 长沙县'],['普通'],[],['幼儿园'],['湖南省郊区衡北新村'],[]
芙蓉区小贝比托幼中心,['湖南省 长沙市 芙蓉区'],['普通'],[],['幼儿园'],['下宜园１０号'],['4441198']
长沙客车制造总厂幼儿园,['湖南省 长沙市 长沙县'],['普通'],[],['幼儿园'],['湖南省郊区韶山路153号'],[]
长沙县榔梨镇艺术幼儿园,['湖南省 长沙市 长沙县'],['普通'],[],['幼儿园'],['榔梨镇土岭村'],['6800865']
望城县雷锋镇小天使幼儿园,['湖南省 长沙市 望城区'],['普通'],[],['幼儿园'],['雷锋镇安庆路８０号'],['8106076']
长沙市人民政府机关荷花幼儿园第三分园,['湖南省 长沙市 长沙县'],['普通'],[],['幼儿园'],['人民新村２８栋'],['4132494']
长沙县黄花镇开慧幼儿园,['湖南省 长沙市 长沙县'],['普通'],[],['幼儿园'],['黄花镇黄龙村'],['6390632']
长沙市小太阳幼儿园,['湖南省 长沙市 芙蓉区'],['普通'],[],['幼儿园'],['湖南省长沙市芙蓉区浏正街菜根香26号'],['2256512']
耒阳西湖幼儿园,['湖南省 长沙市'],['普通'],[],['幼儿园'],[],[]
湖南省长沙船舶厂幼儿园,['湖南省 长沙市 岳麓区'],['普通'],[],['幼儿园'],['湖南省长沙市岳麓区观沙岭街道岳围社区'],['8809527']
长沙县星沙镇蓓蕾幼儿园,['湖南省 长沙市 长沙县'],['普通'],[],['幼儿园'],['星沙镇二区５１栋４１３号'],['4012334']
长沙市奥星幼儿园,['湖南省 长沙市 开福区'],['普通'],[],['幼儿园'],['湖南省长沙市开福区体育馆路1号'],['2237237']
长沙县江背镇朱桥中英文幼稚园,['湖南省 长沙市 长沙县'],['普通'],[],['幼儿园'],['江背镇朱桥街'],['6292399']
长沙县黄花镇新星幼儿园,['湖南省 长沙市 长沙县'],['普通'],[],['幼儿园'],['湖南省长沙县黄花镇黄回路46号'],['6390583']
长沙县星沙艺术幼儿园,['湖南省 长沙市 长沙县'],['普通'],[],['幼儿园'],['湖南省长沙县星沙镇二区57栋'],['4012785']
长沙县星沙镇中英文幼稚园,['湖南省 长沙市 长沙县'],['普通'],[],['幼儿园'],['星沙镇四区１２栋５号'],['4069575']
长沙县黄花镇小太阳艺术幼儿园,['湖南省 长沙市 长沙县'],['普通'],[],['幼儿园'],['黄花镇东培村２号'],['13975862733']
长沙知行艺校幼儿园,['湖南省 长沙市 天心区'],['普通'],[],['幼儿园'],['湖南省长沙市天心区赵家院子25'],['5201229']
株洲车辆厂幼儿园,['湖南省 长沙市'],['普通'],[],['幼儿园'],['湖南省株洲市荷塘区宋家桥新华东路'],['8408090']
长沙县北山镇童星艺术幼儿园,['湖南省 长沙市 长沙县'],['普通'],[],['幼儿园'],['北山镇王公桥'],['6790169']
湖南省长沙县北山镇幼儿园,['湖南省 长沙市 长沙县'],['普通'],[],['幼儿园'],['湖南省长沙县北山镇蒿塘'],['6747498']
湖南省文化艺术幼儿园,['湖南省 长沙市 芙蓉区'],['普通'],[],['幼儿园'],['湖南省长沙市芙蓉区人民东路702号'],['4123939']
长沙市政府机关荷花幼儿园第二分园,['湖南省 长沙市 长沙县'],['普通'],[],['幼儿园'],['湘春路３２２号'],['4312161']
湖南省商业幼儿园,['湖南省 长沙市 芙蓉区'],['普通'],[],['幼儿园'],['湖南省长沙市芙蓉区桐荫里46号'],['4445051']
湖南磷化总厂幼儿园,['湖南省 长沙市 浏阳市'],['普通'],[],['幼儿园'],['湖南省浏阳市永和镇孚田'],['3506408']
醴陵市体育路幼儿园,['湖南省 长沙市'],['普通'],[],['幼儿园'],['湖南省醴陵市渌江泉湖'],['3035479']
长沙市芙蓉幼儿园,['湖南省 长沙市 天心区'],['普通'],[],['幼儿园'],['湖南省长沙市天心区涂家冲195号'],['5212235']
长沙县江背镇小太阳幼儿园,['湖南省 长沙市 长沙县'],['普通'],[],['幼儿园'],['江背镇铁锁村马公桥组'],['6290846']
株洲市铁四院一分院艺术幼儿园,['湖南省 长沙市'],['普通'],[],['幼儿园'],['湖南省株洲市荷塘区宋家桥戴家岭'],['2681415']
长沙县星沙镇新星幼儿园,['湖南省 长沙市 长沙县'],['普通'],[],['幼儿园'],['湖南省长沙县星沙镇星沙商业城105栋'],['4010343']
长沙县江背镇家佳艺术幼儿园,['湖南省 长沙市 长沙县'],['普通'],[],['幼儿园'],['江背镇砖田村高塘组'],['6265997']
长沙县安沙镇安沙艺术幼儿园,['湖南省 长沙市 长沙县'],['普通'],[],['幼儿园'],['安沙镇安沙中路'],['6706578']
攸县黄丰桥蓝天幼儿园,['湖南省 长沙市'],['普通'],[],['幼儿园'],['湖南省攸县黄丰桥湖丽坪'],['4683020']
长沙交通学院后勤服务总公司幼儿园,['湖南省 长沙市 天心区'],['普通'],[],['幼儿园'],['湖南省长沙市天心区赤岭路45号'],['5219464']
长沙县星沙镇英才幼儿园,['湖南省 长沙市 长沙县'],['普通'],[],['幼儿园'],['湖南省长沙县星沙镇四区71栋387号'],['4011405']
长沙县江背镇小天使艺术幼儿园,['湖南省 长沙市 长沙县'],['普通'],[],['幼儿园'],['江背镇河田村河田组'],['6267261']
醴陵市开心幼儿园,['湖南省 长沙市'],['普通'],[],['幼儿园'],['湖南省醴陵市新胜'],['3229311']
