长沙市小百灵艺术幼儿园,['湖南省 长沙市 开福区'],['普通'],['公办'],['幼儿园'],['湖南省长沙市开福区黑石渡德雅路631号'],['4222519']
望城县高塘岭镇实验艺术幼儿园,['湖南省 长沙市 望城区'],['普通'],[],['幼儿园'],['高塘岭镇实验小学内'],['8082256']
浏阳市诚信幼稚园,['湖南省 长沙市 浏阳市'],['普通'],['民办'],['幼儿园'],['湖南省长沙市浏阳市北正中路指背冲路口（淮川派出所侧）/浏阳市车站路花炮美神（顺天新城后面）'],['0731-3655550/0731-3655551']
株洲市荷塘区文化路幼儿园,['湖南省 长沙市'],['普通'],[],['幼儿园'],['湖南省株洲市荷塘区月塘文化路'],['2130281']
宁乡县城郊宝贝,['湖南省 长沙市 宁乡县'],['普通'],[],['幼儿园'],['宁乡十三中旁\n联系人：谢老师'],['7800553']
望城县星城镇好朋友幼儿园,['湖南省 长沙市 望城区'],['普通'],['公办'],['幼儿园'],[],[]
航天局幼儿园,['湖南省 长沙市 望城区'],['普通'],['公办'],['幼儿园'],['湖南省长沙市河西望城坡汽车西站往西行500米航天局大院内'],['0731――8149953 13974964943']
湖南省肿瘤医院幼儿园,['湖南省 长沙市 岳麓区'],['普通'],[],['幼儿园'],['湖南省长沙市岳麓区咸嘉湖路'],['8651916']
长沙市天心区青草地幼儿园,['湖南省 长沙市 天心区'],['普通'],['公办'],['幼儿园'],['长沙市解放四村142号曙光小学旁青草地幼儿园'],['0731－5132620']
诺贝尔摇篮世界之窗幼稚园,['湖南省 长沙市 开福区'],['普通'],['民办'],['幼儿园'],['湖南省长沙市世界之窗古巴比伦空中花园'],['18874706395']
长沙市芙蓉区方舟艺术幼儿园,['湖南省 长沙市 芙蓉区'],['普通'],[],['幼儿园'],['韶山北路３９号维一星城内'],['4895557']
长沙市芙蓉区小花朵幼儿园,['湖南省 长沙市 芙蓉区'],['普通'],[],['幼儿园'],['湖南省长沙市芙蓉区东岸乡西龙'],['4680070']
宁乡县玉潭镇八一路幼儿园,['湖南省 长沙市 宁乡县'],['普通'],[],['幼儿园'],['湖南省宁乡县玉潭镇八一东路42号'],['7821083']
长沙县星沙镇蓝精灵艺术幼儿园,['湖南省 长沙市 长沙县'],['普通'],[],['幼儿园'],['星沙镇五区５０栋'],['13077336340']
长沙县干杉乡斗塘小神童幼儿园,['湖南省 长沙市 长沙县'],['普通'],[],['幼儿园'],['干杉乡斗塘村'],['6843450']
湖南航天公共服务有限公司幼儿园,['湖南省 长沙市 岳麓区'],['普通'],[],['幼儿园'],['湖南省长沙市岳麓区天顶乡枫林二路631号'],['8149953']
小杜鹃艺术幼儿园,['湖南省 长沙市 开福区'],['普通'],[],['幼儿园'],['湖南省长沙市开福区中山路188号'],['4420846']
长沙萌芽第一幼稚园,['湖南省 长沙市 岳麓区'],['普通'],[],['幼儿园'],['长沙市岳麓区银杏路177号湘仪菜市场（湘仪路口）'],['0731-2890512']
长沙市岳麓区咪咪幼儿园,['湖南省 长沙市 岳麓区'],['普通'],['公办'],['幼儿园'],[],[]
长沙市芙蓉区儿童家园幼稚园,['湖南省 长沙市 芙蓉区'],['普通'],['公办'],['幼儿园'],['车站北路228号王府花园小区（7栋后面）'],['0731-82184180']
蒙特梭利儿童之家,['湖南省 长沙市 岳麓区'],['普通'],['民办'],['幼儿园'],['湖南省长沙市岳麓区金星中路528号（茉莉花酒店旁）'],['13574871451']
百乐娃艺术幼儿园,['湖南省 长沙市'],['普通'],[],['幼儿园'],[],['13548550550']
长沙县高桥镇小星星幼儿园,['湖南省 长沙市 长沙县'],['普通'],[],['幼儿园'],['高桥镇省茶叶研究所内院长：汤应来'],['6155010']
株洲市石峰区花果山幼儿园,['湖南省 长沙市'],['普通'],[],['幼儿园'],['湖南省株洲市石峰区清水塘'],['8331693']
醴陵市建美幼儿园,['湖南省 长沙市'],['普通'],[],['幼儿园'],['湖南省醴陵市二圣路43号'],['3029153']
