长沙市航空幼儿园,['湖南省 长沙市 天心区'],['普通'],[],['幼儿园'],['湖南省长沙市天心区小古道巷28号'],['5825471']
长沙县黄花镇实验幼儿园,['湖南省 长沙市 长沙县'],['普通'],[],['幼儿园'],['湖南省长沙县黄花镇黄花路居委会附2号'],['6390021']
长沙县青山铺镇赛头幼儿园,['湖南省 长沙市 长沙县'],['普通'],[],['幼儿园'],['湖南省长沙县青山铺镇赛头村委会'],['6468959']
湖南省长沙县北山镇苗苗幼儿园,['湖南省 长沙市 长沙县'],['普通'],[],['幼儿园'],['湖南省长沙县北山镇荣合桥'],['6790168']
长沙市盼盼艺术幼儿园,['湖南省 长沙市 天心区'],['普通'],[],['幼儿园'],['湖南省长沙市天心区流水沟49号'],['5817756']
长沙市雨花区华成第一幼稚园,['湖南省 长沙市'],['普通'],[],['幼儿园'],['香樟路'],['5594919']
长沙市雨花区金色摇篮幼稚园,['湖南省 长沙市 长沙县'],['普通'],[],['幼儿园'],['赤岗北路长沙阀门厂宿舍内'],['5495627']
湖南省群众艺术馆幼儿园,['湖南省 长沙市 天心区'],['普通'],[],['幼儿园'],['湖南省长沙市天心区坡子街65'],['5818513']
长沙市少年宫蓓蕾艺术幼儿园,['湖南省 长沙市 芙蓉区'],['普通'],[],['幼儿园'],['湖南省长沙市芙蓉区府后街东牌楼2号'],['2225139']
长沙市东风二村居委会幼儿园,['湖南省 长沙市 开福区'],['普通'],[],['幼儿园'],['湖南省长沙市开福区东风二村6栋西头'],['4552264']
长沙县咪咪幼儿园,['湖南省 长沙市 长沙县'],['普通'],[],['幼儿园'],['湖南省长沙县跳马乡石燕'],['6968081']
茶陵县城西幼儿园,['湖南省 长沙市'],['普通'],[],['幼儿园'],['湖南省茶陵县城关炎帝中路'],['5222236']
株洲县淦田欣欣幼儿园,['湖南省 长沙市'],['普通'],[],['幼儿园'],['湖南省株洲县淦田'],['7257058']
株洲市荷塘区晏家湾艺术幼儿园,['湖南省 长沙市'],['普通'],[],['幼儿园'],['湖南省株洲市荷塘区宋家桥桂花路口'],['8424595']
长沙县干杉乡旺旺幼儿园,['湖南省 长沙市 长沙县'],['普通'],[],['幼儿园'],['干杉集镇'],['6841886']
长沙县北山镇启智幼儿园,['湖南省 长沙市 长沙县'],['普通'],[],['幼儿园'],['北山镇荣合桥集镇'],['13874812513']
长沙市开福区教工幼儿园,['湖南省 长沙市 开福区'],['普通'],[],['幼儿园'],['湖南省长沙市开福区轩辕殿51号'],['2224016']
长沙韶光微电子总公司幼儿园,['湖南省 长沙市 长沙县'],['普通'],[],['幼儿园'],['湖南省长沙县榔梨镇秋塘村委会'],['4616076']
长沙二机床厂职工幼儿园,['湖南省 长沙市 天心区'],['普通'],[],['幼儿园'],['湖南省长沙市天心区金盆岭2号'],['5214760']
株洲市橡塑院幼儿园,['湖南省 长沙市'],['普通'],[],['幼儿园'],['湖南省株洲市荷塘区荷塘铺橡塑院生活区'],['2495114']
长沙县黄花镇新时代幼儿园,['湖南省 长沙市 长沙县'],['普通'],[],['幼儿园'],['黄花镇蛟塘村'],['6300455']
湖南省长沙县北山镇顺顺幼儿园,['湖南省 长沙市 长沙县'],['普通'],[],['幼儿园'],['湖南省长沙县北山镇高仓村'],['6771266']
长沙县北山镇顺顺幼儿园,['湖南省 长沙市 长沙县'],['普通'],[],['幼儿园'],['北山镇高仓集镇'],['6771266']
长沙县果园镇快乐宝贝幼儿园,['湖南省 长沙市 长沙县'],['普通'],[],['幼儿园'],['果园镇云泉村培上组１９４号'],['6186281']
醴陵霞辉幼儿园,['湖南省 长沙市'],['普通'],[],['幼儿园'],['湖南省醴陵市大坡里187号'],['3227723']
株洲市钨钼材料厂幼儿园,['湖南省 长沙市'],['普通'],[],['幼儿园'],['湖南省株洲市荷塘区茨菇塘钨钼材料厂'],['13017118']
株洲市荷塘区皮皮王幼儿园,['湖南省 长沙市'],['普通'],[],['幼儿园'],['湖南省株洲市荷塘区茨菇塘四O四队'],['8100098']
株洲市第二文化宫幼儿园,['湖南省 长沙市'],['普通'],[],['幼儿园'],['湖南省株洲市天元区泰山路铁西'],['8826746']
株洲电力机车厂第一幼儿园,['湖南省 长沙市'],['普通'],[],['幼儿园'],['湖南省株洲市石峰区田心'],['8464254']
湖南幼集团公司幼儿园,['湖南省 长沙市 开福区'],['普通'],[],['幼儿园'],['湖南省长沙市开福区新河路47号'],['4480038']
株洲市石峰区启明星第二幼儿园,['湖南省 长沙市'],['普通'],[],['幼儿园'],['湖南省株洲市石峰区清水塘'],['8339303']
株洲电业局幼儿园,['湖南省 长沙市'],['普通'],[],['幼儿园'],['湖南省株洲市荷塘区月塘文化'],['8142563']
炎陵县小精灵幼儿园,['湖南省 长沙市'],['普通'],[],['幼儿园'],['湖南省炎陵县霞阳炎陵路'],['6223481']
长沙县育苗艺术幼儿园,['湖南省 长沙市 长沙县'],['普通'],[],['幼儿园'],['湖南省长沙县星沙镇泉塘村委会'],['4070630']
醴陵市福音幼儿园,['湖南省 长沙市'],['普通'],[],['幼儿园'],['湖南省醴陵市胜利'],['3271612']
株洲市电力机车厂第二幼儿园,['湖南省 长沙市'],['普通'],[],['幼儿园'],['湖南省株洲市石峰区田心'],['8465774']
长沙县江背镇世纪星艺术幼儿园,['湖南省 长沙市 长沙县'],['普通'],[],['幼儿园'],['江背镇梅花村２６８号'],['6291377']
醴陵市刘老师幼儿园,['湖南省 长沙市'],['普通'],[],['幼儿园'],['湖南省醴陵市国光'],['3228375']
醴陵市旺旺幼儿园,['湖南省 长沙市'],['普通'],[],['幼儿园'],['湖南省醴陵市渌江西山'],['3284403']
株洲市石峰区爱爱幼儿园,['湖南省 长沙市'],['普通'],[],['幼儿园'],['湖南省株洲市石峰区田心'],['8339030']
株洲市1+1幼儿园,['湖南省 长沙市'],['普通'],[],['幼儿园'],['湖南省株洲市荷塘区茨菇塘荷塘村小区'],['8422622']
株洲市荷塘区金钥匙艺术幼儿园,['湖南省 长沙市'],['普通'],[],['幼儿园'],['湖南省株洲市荷塘区月塘野鸭冲4号'],['8422931']
长沙县星沙蓓蕾幼儿园,['湖南省 长沙市 长沙县'],['普通'],[],['幼儿园'],['湖南省长沙县星沙镇二区51栋415号'],['4012334']
长沙县北山镇蓓蕾幼儿园,['湖南省 长沙市 长沙县'],['普通'],[],['幼儿园'],['北山镇青竹村'],['6771966']
醴陵市兴业总公司幼儿园,['湖南省 长沙市'],['普通'],[],['幼儿园'],['湖南省醴陵市黄泥坳花园庵270号'],['3228842']
长沙市开福区铁山幼儿园,['湖南省 长沙市 开福区'],['普通'],[],['幼儿园'],['湖南省长沙市开福区铁佛东街10号'],['4312507']
醴陵娃哈哈幼儿园,['湖南省 长沙市'],['普通'],[],['幼儿园'],['湖南省醴陵市左权'],['3280338']
长沙县蓝精灵幼儿园,['湖南省 长沙市 长沙县'],['普通'],[],['幼儿园'],['湖南省长沙县星沙镇星沙大市场二居委会'],['4060060']
醴陵市蓝精灵幼儿园,['湖南省 长沙市'],['普通'],[],['幼儿园'],['湖南省醴陵市解放'],['3030029']
长沙县青山镇镇新苗幼儿园,['湖南省 长沙市 长沙县'],['普通'],[],['幼儿园'],['湖南省长沙县青山铺镇广福村委会'],['6468567']
长沙县北山镇水田幼儿园,['湖南省 长沙市 长沙县'],['普通'],[],['幼儿园'],['北山镇水田村'],['6771811']
长沙县青山铺镇小英才幼儿园,['湖南省 长沙市 长沙县'],['普通'],[],['幼儿园'],['湖南省长沙县青山铺镇青山村委会'],['6468033']
长沙县北山镇苗苗艺术幼儿园,['湖南省 长沙市 长沙县'],['普通'],[],['幼儿园'],['北山镇石常集镇'],['6790168']
株铁二幼儿园,['湖南省 长沙市'],['普通'],['公办'],['幼儿园'],['湖南省株洲市荷塘区月塘秧田嘴'],['2683421']
醴陵市红星幼儿园,['湖南省 长沙市'],['普通'],[],['幼儿园'],['湖南省醴陵市泗汾车站'],['3522495']
醴陵市智多星幼儿园,['湖南省 长沙市'],['普通'],[],['幼儿园'],['湖南省醴陵市黄泥坳19号'],['3227348']
株洲市五公怀幼儿园,['湖南省 长沙市'],['普通'],[],['幼儿园'],['湖南省株洲市荷塘区宋家桥戴家岭'],['8330434']
醴陵新星幼儿园,['湖南省 长沙市'],['普通'],[],['幼儿园'],['湖南省醴陵市左权'],['3281522']
长沙县青山铺针天山幼儿园,['湖南省 长沙市 长沙县'],['普通'],[],['幼儿园'],['湖南省长沙县青山铺镇田家垅'],['6468624']
长沙县江背镇卫星幼儿园,['湖南省 长沙市 长沙县'],['普通'],[],['幼儿园'],['江背镇毛岭冲'],['6264828']
长沙县黄花镇艺术幼儿园,['湖南省 长沙市 长沙县'],['普通'],[],['幼儿园'],['湖南省长沙县黄花镇黄花路居委会'],['6390027']
株洲县普天通信设备厂幼儿园,['湖南省 长沙市'],['普通'],[],['幼儿园'],['湖南省株洲县渌口姚家岭'],['7622883']
株洲市荷塘区燕山幼儿园,['湖南省 长沙市'],['普通'],[],['幼儿园'],['湖南省株洲市荷塘区月塘合泰'],['8241382']
望城县乌山镇中心幼儿园,['湖南省 长沙市 望城区'],['普通'],[],['幼儿园'],['乌山镇徐家桥'],['8472425']
株洲市汽齿幼儿园,['湖南省 长沙市'],['普通'],[],['幼儿园'],['湖南省株洲市荷塘区月塘新华西路119号'],['8496433']
株洲市文化路幼儿园,['湖南省 长沙市'],['普通'],[],['幼儿园'],['湖南省株洲市荷塘区月塘文化路'],['13973357']
株洲市美天艺术幼儿园,['湖南省 长沙市'],['普通'],[],['幼儿园'],['湖南省株洲市荷塘区宋家桥新华东路98号'],['8422931']
醴陵市湘林幼儿园,['湖南省 长沙市'],['普通'],[],['幼儿园'],['湖南省醴陵市解放路132号'],['3222132']
醴陵市电瓷厂幼儿园,['湖南省 长沙市'],['普通'],[],['幼儿园'],['湖南省醴陵市来龙门马放塘'],['3242209']
长沙县北山镇新星艺术幼儿园,['湖南省 长沙市 长沙县'],['普通'],[],['幼儿园'],['北山镇新中村'],['13874889491']
株洲市金洋幼儿园,['湖南省 长沙市'],['普通'],[],['幼儿园'],['湖南省株洲市荷塘区宋家桥戴家岭路'],['8402768']
株洲市石峰区雏鹰幼儿园,['湖南省 长沙市'],['普通'],[],['幼儿园'],['湖南省株洲市石峰区杨梅塘散户'],['8337693']
株洲市小风车幼儿园,['湖南省 长沙市'],['普通'],[],['幼儿园'],['湖南省株洲市荷塘区宋家桥湘华机械厂'],['2494954']
株洲工学院幼儿园,['湖南省 长沙市'],['普通'],[],['幼儿园'],['湖南省株洲市荷塘区月塘工学院'],['2622897']
株洲市天元区天源幼儿园,['湖南省 长沙市'],['普通'],[],['幼儿园'],['湖南省株洲市天元区泰山路云里'],['2881767']
株洲市直属机关幼儿园,['湖南省 长沙市'],['普通'],[],['幼儿园'],['湖南省株洲市芦淞区建设后街1号'],['8238056']
湖南省长沙县北山镇培蕾幼儿园,['湖南省 长沙市 长沙县'],['普通'],[],['幼儿园'],['湖南省长沙县北山镇青竹'],['6771966']
长沙县星沙镇新苗幼儿园,['湖南省 长沙市 长沙县'],['普通'],[],['幼儿园'],['湖南省长沙县星沙镇三区居委会三十四栋237号'],['4067321']
醴陵市永乐幼儿园,['湖南省 长沙市'],['普通'],[],['幼儿园'],['湖南省醴陵市东风巷28号'],['3226370']
株洲市铁三幼儿园,['湖南省 长沙市'],['普通'],[],['幼儿园'],['湖南省株洲市天元区泰山路铁西'],['2183431']
株洲市水文队幼儿园,['湖南省 长沙市'],['普通'],[],['幼儿园'],['湖南省株洲市荷塘区宋家桥水文一队'],['2492732']
株洲市荷塘区怡静幼儿园,['湖南省 长沙市'],['普通'],[],['幼儿园'],['湖南省株洲市荷塘区月塘合泰'],['8240837']
醴陵群英幼儿园,['湖南省 长沙市'],['普通'],[],['幼儿园'],['湖南省醴陵市胜利'],['3242051']
醴陵市宝宝乐幼儿园,['湖南省 长沙市'],['普通'],[],['幼儿园'],['湖南省醴陵市渌江五里牌'],['3263469']
醴陵市小天使幼儿园,['湖南省 长沙市'],['普通'],[],['幼儿园'],['湖南省醴陵市渌江石子岭'],['3251320']
株洲市荷塘区芳芳幼儿园,['湖南省 长沙市'],['普通'],[],['幼儿园'],['湖南省株洲市荷塘区月塘合泰'],['8422931']
醴陵市灵芝幼儿园,['湖南省 长沙市'],['普通'],[],['幼儿园'],['湖南省醴陵市解放'],['3240566']
株洲市天元区苗苗幼儿园,['湖南省 长沙市'],['普通'],[],['幼儿园'],['湖南省株洲市天元区嵩山路大湖塘'],['8837786']
株洲市石峰区百灵艺术幼儿园,['湖南省 长沙市'],['普通'],[],['幼儿园'],['湖南省株洲市石峰区清水塘'],['8333930']
株洲市好孩子幼儿园,['湖南省 长沙市'],['普通'],[],['幼儿园'],['湖南省株洲市荷塘区宋家桥水文路108号'],['13055112']
醴陵市桥南幼儿园,['湖南省 长沙市'],['普通'],[],['幼儿园'],['湖南省醴陵市阳三立三路15号'],['3031300']
株洲市石峰区三冲社区幼儿园,['湖南省 长沙市'],['普通'],[],['幼儿园'],['湖南省株洲市石峰区田心'],['8438247']
醴陵市红苹果幼儿园,['湖南省 长沙市'],['普通'],[],['幼儿园'],['湖南省醴陵市胜利路147号'],['3243206']
醴陵市小星星幼儿园,['湖南省 长沙市'],['普通'],[],['幼儿园'],['湖南省醴陵市谭家冲'],['3222299']
株洲市世纪星幼儿园,['湖南省 长沙市'],['普通'],[],['幼儿园'],['湖南省株洲市荷塘区茨菇塘天鹅花园'],['13973387']
株洲市天元区晓晓幼儿园,['湖南省 长沙市'],['普通'],[],['幼儿园'],['湖南省株洲市天元区泰山路滨江'],['8826371']
醴陵市电焊条厂幼儿园,['湖南省 长沙市'],['普通'],[],['幼儿园'],['湖南省醴陵市左权'],['3220306']
攸县蓓蕾幼儿园,['湖南省 长沙市'],['普通'],[],['幼儿园'],['湖南省攸县城关联星'],['4237713']
株洲市新世纪艺术幼儿园,['湖南省 长沙市'],['普通'],[],['幼儿园'],['湖南省株洲市荷塘区茨菇塘路'],['8163318']
湖南省长沙县北山镇水田幼儿园,['湖南省 长沙市 长沙县'],['普通'],[],['幼儿园'],['湖南省长沙县北山镇水田'],['6771811']
醴陵市湘东幼儿园,['湖南省 长沙市'],['普通'],[],['幼儿园'],['湖南省醴陵市大桥北路1号'],['3221303']
株洲市小天鹅幼儿园,['湖南省 长沙市'],['普通'],[],['幼儿园'],['湖南省株洲市荷塘区茨菇塘天鹅花园'],['8454577']
醴陵快乐幼儿园,['湖南省 长沙市'],['普通'],[],['幼儿园'],['湖南省醴陵市泗汾车站'],['3525455']
攸县新星幼儿园,['湖南省 长沙市'],['普通'],[],['幼儿园'],['湖南省攸县城关北街'],['4225920']
株铁一幼儿园,['湖南省 长沙市'],['普通'],[],['幼儿园'],['湖南省株洲市荷塘区月塘石塘冲'],['2683411']
醴陵市小太阳实验幼儿园,['湖南省 长沙市'],['普通'],[],['幼儿园'],['湖南省醴陵市渌江丁家坊'],['3272714']
醴陵市天天乐幼儿园,['湖南省 长沙市'],['普通'],[],['幼儿园'],['湖南省醴陵市左权'],['3286152']
株洲市六0一幼儿园,['湖南省 长沙市'],['普通'],[],['幼儿园'],['湖南省株洲市荷塘区茨菇塘'],['8261253']
醴陵市童乐幼儿园,['湖南省 长沙市'],['普通'],[],['幼儿园'],['湖南省醴陵市左权'],['3285572']
醴陵市莅蕾幼儿园,['湖南省 长沙市'],['普通'],[],['幼儿园'],['湖南省醴陵市渌江泉湖'],['3241877']
醴陵市童星幼儿园,['湖南省 长沙市'],['普通'],[],['幼儿园'],['湖南省醴陵市阳三'],['3035762']
醴陵市小太阳幼儿园,['湖南省 长沙市'],['普通'],[],['幼儿园'],['湖南省醴陵市渌江丁家坊'],['3272714']
湖电幼儿园,['湖南省 长沙市'],['普通'],[],['幼儿园'],['湖南省醴陵市阳三立三路6号'],['3040412']
攸县大同桥教育办幼儿园,['湖南省 长沙市'],['普通'],[],['幼儿园'],['湖南省攸县大同桥善桥'],['4762598']
株洲市荷塘区启明星幼儿园,['湖南省 长沙市'],['普通'],[],['幼儿园'],['湖南省株洲市荷塘区月塘南岳岭烟山口'],['13055137']
醴陵市醴泉幼儿园,['湖南省 长沙市'],['普通'],[],['幼儿园'],['湖南省醴陵市渌江五里牌'],['3261139']
醴陵市好乐乐幼儿园,['湖南省 长沙市'],['普通'],[],['幼儿园'],['湖南省醴陵市渌江老龙井'],['3252110']
醴陵市碧山岭星星幼儿园,['湖南省 长沙市'],['普通'],[],['幼儿园'],['湖南省醴陵市西山碧山路23号'],['3283126']
天剑二委幼儿园,['湖南省 长沙市 天心区'],['普通'],[],['幼儿园'],['湖南省长沙市天心区天剑二村九栋右侧'],['5814019']
醴陵市蓝天幼儿园,['湖南省 长沙市'],['普通'],[],['幼儿园'],['湖南省醴陵市解放'],['3222446']
株洲市新苗幼儿园,['湖南省 长沙市'],['普通'],[],['幼儿园'],['湖南省株洲市荷塘区宋家桥向阳村'],['8422931']
醴陵市阳光幼儿园,['湖南省 长沙市'],['普通'],[],['幼儿园'],['湖南省醴陵市渌江泉湖'],['3020047']
炎陵县商业局幼儿园,['湖南省 长沙市'],['普通'],[],['幼儿园'],['湖南省炎陵县霞阳井冈路'],['6222422']
长沙县果园镇世纪星幼儿园,['湖南省 长沙市 长沙县'],['普通'],['公办'],['幼儿园'],['果园镇杨泗庙'],['13017282269']
望城县含浦镇小英才幼稚园,['湖南省 长沙市 望城区'],['普通'],[],['幼儿园'],['含浦镇栗乔村'],['8551950']
望城县童星艺术幼儿园,['湖南省 长沙市 望城区'],['普通'],[],['幼儿园'],['莲湖重建地'],['13874831518']
株洲市彩虹幼儿园,['湖南省 长沙市'],['普通'],[],['幼儿园'],['湖南省株洲市天元区嵩山路联谊新村内'],['2868608']
长沙中国建筑第五工程局幼儿园,['湖南省 长沙市 长沙县'],['普通'],[],['幼儿园'],['湖南省郊区井湾子路20号'],[]
长沙市雨花区红星小学红星幼儿园,['湖南省 长沙市 雨花区'],['普通'],[],['幼儿园'],['湖南省长沙市雨花区井湾路27号'],['5010810']
长沙冶金设计研究院总院幼儿园,['湖南省 长沙市 雨花区'],['普通'],[],['幼儿园'],['湖南省长沙市雨花区劳动东路78号'],['5553189']
湖南省儿童医院幼儿园,['湖南省 长沙市 雨花区'],['普通'],[],['幼儿园'],['湖南省长沙市雨花区梓园路82号'],['5600924']
长沙市菁菁幼儿园,['湖南省 长沙市 雨花区'],['普通'],[],['幼儿园'],['湖南省长沙市雨花区砂子塘23栋'],['5552420']
长沙市教育实验幼儿园,['湖南省 长沙市 雨花区'],['普通'],[],['幼儿园'],['湖南省长沙市雨花区雨花路88号'],['5537095']
湖南计算机厂有限公司幼儿园,['湖南省 长沙市 雨花区'],['普通'],[],['幼儿园'],['湖南省长沙市雨花区雨花路161号'],['5554610']
三湘客车集团责任有限公司幼儿园,['湖南省 长沙市 雨花区'],['普通'],[],['幼儿园'],['湖南省长沙市雨花区韶山路153'],['5672151']
长沙顺特变压器厂幼儿园,['湖南省 长沙市 雨花区'],['普通'],[],['幼儿园'],['湖南省长沙市雨花区劳动东路382号'],['5532677']
火焰村幼儿园,['湖南省 长沙市 雨花区'],['普通'],[],['幼儿园'],['湖南省长沙市雨花区火焰'],['5710789']
长沙重型机器厂幼儿园,['湖南省 长沙市 雨花区'],['普通'],[],['幼儿园'],['湖南省长沙市雨花区树木岭路126'],['5317294']
长沙市雨花区马家冲艺术幼儿园,['湖南省 长沙市 雨花区'],['普通'],[],['幼儿园'],['湖南省长沙市雨花区马家冲'],['5506501']
广东美雅集团长沙毛纺织厂幼儿园,['湖南省 长沙市 岳麓区'],['普通'],[],['幼儿园'],['湖南省长沙市岳麓区观沙岭街道毛纺社区'],['8809211']
长沙机床厂幼儿园,['湖南省 长沙市 天心区'],['普通'],[],['幼儿园'],['湖南省长沙市天心区新市街1号'],['5414700']
株洲县渌口艺术幼儿园,['湖南省 长沙市'],['普通'],[],['幼儿园'],['湖南省株洲县渌口渌浦路'],['7617936']
宁乡县玉潭镇南郊幼儿园,['湖南省 长沙市 宁乡县'],['普通'],[],['幼儿园'],['湖南省宁乡县玉潭镇湘乡街'],['7888888']
长沙县青山铺镇博雅幼儿园,['湖南省 长沙市 长沙县'],['普通'],['公办'],['幼儿园'],['湖南省长沙县青山铺镇金山桥村委会'],['6468830']
长沙市雨花区高桥乡友谊幼儿园,['湖南省 长沙市 雨花区'],['普通'],[],['幼儿园'],['湖南省长沙市雨花区友谊'],['5712715']
株洲市芦淞区建宁幼儿园,['湖南省 长沙市'],['普通'],[],['幼儿园'],['湖南省株洲市芦淞区解放街3号'],['2282293']
长沙市芙蓉区清水塘幼儿园,['湖南省 长沙市 芙蓉区'],['普通'],[],['幼儿园'],['湖南省长沙市芙蓉区八一路'],['4443648']
开福区建湘幼儿园,['湖南省 长沙市 开福区'],['普通'],[],['幼儿园'],['湖南省长沙市开福区建湘幼儿园'],['4482867']
长沙南方幼儿园,['湖南省 长沙市 岳麓区'],['三级幼儿园'],['公办'],['幼儿园'],['岳麓区含浦科教园南方大学旁，中南大学往南3公里'],['0731-85838183 15367819983']
株洲市天元区小葵花幼儿园,['湖南省 长沙市'],['普通'],[],['幼儿园'],['湖南省株洲市天元区泰山路张家园'],['2881493']
株洲市大风车幼儿园,['湖南省 长沙市'],['普通'],[],['幼儿园'],['湖南省株洲市荷塘区宋家桥戴家岭'],['8400246']
炎陵县示范幼儿园,['湖南省 长沙市'],['普通'],[],['幼儿园'],['湖南省炎陵县霞阳炎帝路'],['6222345']
株洲钻石路幼儿园,['湖南省 长沙市'],['普通'],[],['幼儿园'],['湖南省株洲市荷塘区茨菇塘钻石路'],['8160266']
长沙市芙蓉区月桂幼儿园,['湖南省 长沙市 芙蓉区'],['普通'],['公办'],['幼儿园'],['湖南省长沙市芙蓉区火星'],['4736713']
淮川劳动路幼儿园,['湖南省 长沙市 浏阳市'],['普通'],[],['幼儿园'],['湖南省浏阳市联城'],['3614620']
湖南大学幼儿园(北校区),['湖南省 长沙市 岳麓区'],['普通'],[],['幼儿园'],['湖南省长沙市岳麓区石佳冲6号'],['8684726']
望城县雷锋艺术幼儿园,['湖南省 长沙市 望城区'],['普通'],['公办'],['幼儿园'],['湖南省望城县高塘岭镇'],['8070299']
茶陵县机关幼儿园,['湖南省 长沙市'],['普通'],[],['幼儿园'],['湖南省茶陵县城关腊芫'],['5222049']
长沙县北山镇贝贝艺术幼儿园,['湖南省 长沙市 长沙县'],['普通'],['公办'],['幼儿园'],['北山镇北盛街３７号'],['6747498']
长沙市王家垅社区小百合幼稚园,['湖南省 长沙市 开福区'],['普通'],['民办'],['幼儿园'],['湖南省长沙市开福区东风路326号'],['0731-2343693']
长沙市岳麓区望月湖幼儿园,['湖南省 长沙市 岳麓区'],['普通'],['公办'],['幼儿园'],['湖南省长沙市岳麓区月桂街38号'],['0731-88884403 8884403']
望城县黄金乡小灵通幼儿园（黄金镇中心幼儿园）,['湖南省 长沙市 望城区'],['普通'],['公办'],['幼儿园'],['黄金乡香桥村 望城区黄金镇金山桥社区'],['0731-88385437']
长沙市芙蓉区解放路幼儿园,['湖南省 长沙市 芙蓉区'],['示范幼儿园'],['公办'],['幼儿园'],['湖南省东区丰盈里2号'],['0731-82225253']
长沙县星沙镇幼儿园,['湖南省 长沙市 长沙县'],['普通'],[],['幼儿园'],['湖南省长沙县星沙镇星沙大市场三居委会'],['4018141']
星沙金色童年幼儿园,['湖南省 长沙市'],['普通'],[],['幼儿园'],[],[]
长沙市雨花区雨花亭乡自然村委会幼儿园,['湖南省 长沙市 雨花区'],['普通'],[],['幼儿园'],['湖南省长沙市雨花区自然村'],['5572513']
攸县育才幼儿园,['湖南省 长沙市'],['普通'],['公办'],['幼儿园'],['湖南省攸县城关文化路'],['4224234']
望城县雷锋镇安安幼稚园,['湖南省 长沙市 望城区'],['普通'],[],['幼儿园'],['雷锋镇黄花塘村和平路'],['8107816']
株洲市康艺幼儿园,['湖南省 长沙市'],['普通'],[],['幼儿园'],['湖南省攸县城关北街'],['4231078']
宁乡县双凫铺镇泉井学校,['湖南省 长沙市 宁乡县'],['普通'],[],['幼儿园'],[],[]
高桥子兰幼儿园,['湖南省 长沙市 雨花区'],['普通'],[],['幼儿园'],['湖南省长沙市雨花区火焰'],['5711393']
株洲市星海科艺幼儿园,['湖南省 长沙市'],['普通'],[],['幼儿园'],['湖南省株洲市荷塘区茨菇塘新华西路39号'],['8231096']
醴陵市益智幼儿园,['湖南省 长沙市'],['普通'],[],['幼儿园'],['湖南省醴陵市渌江丁家坊'],['3271612']
株洲市天元区蓝月亮幼儿园,['湖南省 长沙市'],['普通'],[],['幼儿园'],['湖南省株洲市天元区泰山路张家园'],['8837786']
望城县星城镇清华摇篮幼儿园,['湖南省 长沙市 望城区'],['普通'],[],['幼儿园'],[],[]
长沙县北山镇新桥幼儿园,['湖南省 长沙市 长沙县'],['普通'],['公办'],['幼儿园'],['北山镇新桥集镇'],['0731-86770137']
宁乡县幼儿园,['湖南省 长沙市 宁乡县'],['普通'],['公办'],['幼儿园'],['湖南省宁乡县玉潭花明北路'],['7881938']
株洲市金龟子艺术幼儿园,['湖南省 长沙市'],['普通'],[],['幼儿园'],['湖南省株洲市荷塘区宋家桥新华一村内'],['13017127']
望城县机关幼儿园,['湖南省 长沙市 望城区'],['普通'],[],['幼儿园'],['湖南省望城县高塘岭镇雷锋'],['8062933']
醴陵市文庙幼儿园,['湖南省 长沙市'],['普通'],[],['幼儿园'],['湖南省醴陵市来龙门文庙'],['3239874']
宁乡县儿童王国幼儿园,['湖南省 长沙市 宁乡县'],['普通'],[],['幼儿园'],[],[]
雨花区童馨幼儿园,['湖南省 长沙市 雨花区'],['普通'],[],['幼儿园'],['湖南省长沙市雨花区黎托平阳'],['5950095']
长沙市雨花区赤岗幼儿园,['湖南省 长沙市 雨花区'],['普通'],[],['幼儿园'],['湖南省长沙市雨花区赤岗'],['5497061']
